"BROKEN","EPIC","FAILED","FEATURE","PASSED","SKIPPED","STORY","UNKNOWN"
"0","","0","Header","1","0","Validación de Redes Sociales","0"
"0","","0","Componente Lateral","1","0","Validación de Ranking Más Leídas","0"
"0","","0","Footer","1","0","Validación de Redes Sociales","0"
"0","","0","Navegación","1","0","Validación de Tags","0"
"0","","0","Social Share","1","0","Validación de Toolbar de Compartir","0"
"0","","0","Reproductor de Audio","1","0","Validación de Controles Trinity","0"
"0","","0","Notificaciones","1","0","Configuración de Preferencias","0"
"0","","0","Shorts","1","0","Validación Completa del Reproductor","0"
